{
  "contract_id": "runtime-v2",
  "version": "2.0.0",
  "published_at": "2026-03-23",
  "api_base": "/api",
  "contract_endpoint": "/api/contracts/runtime-v2",
  "goals": [
    "Expose the current headless runtime as a manager/portfolio/governance-aware contract.",
    "Make runtime-v2 the sole runtime contract published by the current repository.",
    "Let agent and CLI clients consume governance-native fields and ignore unknown diagnostic payloads."
  ],
  "compatibility": {
    "cli_remains_supported": true,
    "runtime_urls_are_unversioned": true,
    "contract_versioning_strategy": "Canonical contract version is runtime-v2 at /api/contracts/runtime-v2.",
    "unknown_fields_policy": "Agent and CLI clients must ignore unknown object fields.",
    "nullable_fields_policy": "Missing and null should be treated equivalently unless explicitly required.",
    "error_normalization_recommendation": "Client SDK should normalize flat {error} and {status,error} bodies into one client-side error type.",
    "cross_domain_feedback_fragment": {
      "component_ref": "#/components/schemas/responseFeedback",
      "description": "Commander bounded workflows and ask_stock responses expose a shared feedback fragment for user-readable gate/audit summaries.",
      "fields": [
        "message",
        "summary",
        "reason_codes",
        "reason_texts",
        "requires_confirmation",
        "decision",
        "coverage"
      ]
    }
  },
  "components": {
    "error_schemas": {
      "flatError": {
        "type": "object",
        "description": "Most current endpoints return a flat error body on non-2xx.",
        "properties": {
          "error": {
            "type": "string"
          }
        },
        "required": [
          "error"
        ],
        "additionalProperties": false
      },
      "statusError": {
        "type": "object",
        "description": "Config mutation endpoints may return a status-bearing error body.",
        "properties": {
          "status": {
            "type": "string",
            "enum": [
              "error"
            ]
          },
          "error": {
            "type": "string"
          }
        },
        "required": [
          "status",
          "error"
        ],
        "additionalProperties": false
      }
    },
    "schemas": {
      "runtimeStatus": {
        "type": "object",
        "description": "Commander runtime snapshot. Frontend should rely on documented top-level sections and ignore unknown fields inside nested diagnostic objects.",
        "properties": {
          "ts": {
            "type": "string",
            "format": "date-time"
          },
          "detail_mode": {
            "type": "string",
            "enum": [
              "fast",
              "slow"
            ]
          },
          "instance_id": {
            "type": "string"
          },
          "workspace": {
            "type": "string"
          },
          "playbook_dir": {
            "type": "string"
          },
          "model": {
            "type": "string"
          },
          "autopilot_enabled": {
            "type": "boolean"
          },
          "heartbeat_enabled": {
            "type": "boolean"
          },
          "training_interval_sec": {
            "type": "integer"
          },
          "heartbeat_interval_sec": {
            "type": "integer"
          },
          "runtime": {
            "type": "object",
            "additionalProperties": true
          },
          "brain": {
            "type": "object",
            "additionalProperties": true
          },
          "body": {
            "type": "object",
            "additionalProperties": true
          },
          "memory": {
            "type": "object",
            "additionalProperties": true
          },
          "bridge": {
            "type": "object",
            "additionalProperties": true
          },
          "plugins": {
            "type": "object",
            "additionalProperties": true
          },
          "playbooks": {
            "type": "object",
            "additionalProperties": true
          },
          "config": {
            "type": "object",
            "additionalProperties": true
          },
          "data": {
            "type": "object",
            "additionalProperties": true
          },
          "training_lab": {
            "type": "object",
            "additionalProperties": true
          },
          "feedback": {
            "$ref": "#/components/schemas/responseFeedback"
          },
          "next_action": {
            "$ref": "#/components/schemas/responseNextAction"
          }
        },
        "required": [
          "ts",
          "detail_mode",
          "runtime",
          "brain",
          "body",
          "memory",
          "bridge",
          "plugins",
          "playbooks",
          "config",
          "data",
          "training_lab"
        ],
        "additionalProperties": true
      },
      "labStatus": {
        "type": "object",
        "properties": {
          "mode": {
            "type": "string",
            "enum": [
              "quick",
              "deep"
            ]
          },
          "snapshot": {
            "$ref": "#/components/schemas/runtimeStatus"
          }
        },
        "required": [
          "mode",
          "snapshot"
        ],
        "additionalProperties": false
      },
      "chatReply": {
        "type": "object",
        "properties": {
          "reply": {
            "type": "string"
          },
          "next_action": {
            "$ref": "#/components/schemas/responseNextAction"
          },
          "feedback": {
            "$ref": "#/components/schemas/responseFeedback"
          },
          "message": {
            "type": "string"
          },
          "task_bus": {
            "type": "object",
            "additionalProperties": true
          },
          "session_key": {
            "type": "string"
          },
          "chat_id": {
            "type": "string"
          },
          "request_id": {
            "type": "string"
          }
        },
        "required": [
          "reply"
        ],
        "additionalProperties": false
      },
      "chatStreamConnected": {
        "type": "object",
        "properties": {
          "status": {
            "type": "string",
            "enum": [
              "connected"
            ]
          },
          "session_key": {
            "type": "string"
          },
          "chat_id": {
            "type": "string"
          },
          "request_id": {
            "type": "string"
          }
        },
        "required": [
          "status",
          "session_key",
          "chat_id",
          "request_id"
        ],
        "additionalProperties": false
      },
      "chatStreamRuntimeEvent": {
        "type": "object",
        "properties": {
          "type": {
            "type": "string",
            "enum": [
              "runtime_event"
            ]
          },
          "id": {
            "type": "string"
          },
          "ts": {
            "type": "string",
            "format": "date-time"
          },
          "event": {
            "type": "string"
          },
          "source": {
            "type": "string"
          },
          "kind": {
            "type": "string"
          },
          "stream_kind": {
            "type": "string"
          },
          "stream_tags": {
            "type": "array",
            "items": {
              "type": "string"
            }
          },
          "stage": {
            "type": "string"
          },
          "phase_label": {
            "type": "string"
          },
          "label": {
            "type": "string"
          },
          "detail": {
            "type": "string"
          },
          "broadcast_text": {
            "type": "string"
          },
          "human_reply": {
            "type": "string"
          },
          "status": {
            "type": "string"
          },
          "risk_level": {
            "type": "string"
          },
          "risk_summary": {
            "type": "string"
          },
          "requires_confirmation": {
            "type": "boolean"
          },
          "confirmation_state": {
            "type": "string"
          },
          "confirmation_summary": {
            "type": "string"
          },
          "session_key": {
            "type": "string"
          },
          "chat_id": {
            "type": "string"
          },
          "request_id": {
            "type": "string"
          },
          "channel": {
            "type": "string"
          },
          "agent": {
            "type": "string"
          },
          "module": {
            "type": "string"
          },
          "meeting": {
            "type": "string"
          },
          "artifacts": {
            "type": "object",
            "additionalProperties": true
          },
          "progress_pct": {
            "type": "integer"
          },
          "display_priority": {
            "type": "integer"
          },
          "display_text": {
            "type": "string"
          }
        },
        "required": [
          "type",
          "id",
          "ts",
          "event",
          "source",
          "kind",
          "stream_kind",
          "stream_tags",
          "stage",
          "phase_label",
          "label",
          "detail",
          "broadcast_text",
          "human_reply",
          "status",
          "risk_level",
          "risk_summary",
          "requires_confirmation",
          "confirmation_state",
          "confirmation_summary",
          "session_key",
          "chat_id",
          "request_id",
          "channel",
          "agent",
          "module",
          "meeting",
          "artifacts",
          "display_priority",
          "display_text"
        ],